{
  "artifact_id": "art_lock_001",
  "artifact_type": "ConsistencyLockSpec",
  "schema_version": "1.0.0",
  "product_dna_id": "art_pdna_001",
  "locks": [
    {
      "lock_id": "lock_001",
      "product_id": "prod_shirt_001",
      "json_path": "$.products[0].attributes[name=neckline]",
      "mode": "hard",
      "rule": "Maintain exact V-neck flat edge with no shirt collar or lapel.",
      "evidence_refs": [
        "ev_neck_1",
        "ev_user_1"
      ]
    },
    {
      "lock_id": "lock_002",
      "product_id": "prod_shirt_001",
      "json_path": "$.products[0].attributes[name=pattern]",
      "mode": "hard",
      "rule": "Preserve black polka-dot pattern and overall distribution.",
      "evidence_refs": [
        "ev_pattern_1"
      ]
    }
  ],
  "global_guards": [
    "Do not invent product parts absent from evidence.",
    "Unknown fields must remain unspecified rather than hallucinated."
  ],
  "created_at": "2026-08-07T04:00:00Z"
}
